s.no,msg,old_tags
1,Implement continuous deployment to angular project using ftp,"['ftp', 'angular6', 'continuous-deployment', 'continuous deployment', 'bitbucket-pipelines', 'bitbucket']"
2,How to fix missing functions directory problem with Netlify continuous deployment?,"['continuous deployment', 'reactjs', 'netlify']"
3,How to set flyway config in continuous deployment pipeline using Travis CI and Azure?,"['flyway', 'azure-web-app-service', 'azure', 'azure-container-service', 'continuous deployment']"
4,"Continuous deployment with gitlab, what are the possible methods?","['continuous deployment', 'gitlab', 'continuous-deployment']"
5,How exactly works build promotion with GitFlow?,"['git', 'continuous-integration', 'continuous deployment', 'jenkins', 'artifactory', 'devops']"
6,Azure Docker Web App - Failed to update data for container settings,"['azure-web-app-service', 'docker', 'azure', 'continuous deployment', 'linux']"
7,Jenkins build failed with &quot;Task &#39;Play&#39; not found in root project&quot; error,"['continuous deployment', 'android', 'jenkins', 'gradle']"
8,aws CodeDeploy vs aws Lambda,"['continuous-deployment', 'continuous deployment', 'amazon-web-services', 'aws-code-deploy', 'aws-lambda']"
9,Best practice to create .NET Web API using generated Server Stub,"['swagger-codegen', 'continuous deployment', 'asp.net-core', 'openapi-generator']"
10,How to Stop or Exit Hangfire,"['continuous deployment', 'hangfire']"
11,How to skip stages in Jenkins based on capacity?,"['continuous-delivery', 'jenkins-pipeline', 'continuous deployment', 'jenkins', 'capacity']"
12,Data loss scenarios while restarting a streaming query with Kafka as source,"['spark-structured-streaming', 'continuous deployment', 'spark-streaming', 'apache-spark']"
13,Horizontal pod autoscaling configuration reset,"['spinnaker', 'horizontal-scaling', 'continuous deployment', 'spinnaker-cam', 'kubernetes-helm']"
14,Deployed Meanstack in AWS Elastic beanstalk and codepipeline but changes made in code are not reflecting server,"['amazon-elastic-beanstalk', 'mean-stack', 'node.js', 'continuous deployment', 'aws-codepipeline', 'github']"
15,"How to configure continuous integration for aws lambda with java using the services of aws aws-codebuild, codedeploy, cloudformation","['aws-codebuild', 'continuous deployment', 'aws-codepipeline', 'amazon-web-services', 'java']"
16,need help to build and deploy ssis packages to Integration Services catalog,"['continuous deployment', 'etl', 'ssis', 'azure-devops']"
17,"Why page is loading continuously, after page refresh in react JS on deployment?","['continuous deployment', 'reactjs']"
18,How can I run a Java Server in a Jenkins job without the job waiting for the Server to close?,"['ubuntu', 'continuous-deployment', 'continuous deployment', 'jenkins', 'java']"
19,Directory &#39;/Users/vsts/agent/2.152.1/work/16/a&#39; is empty. Nothing will be added to build artifact &#39;drop&#39;,"['pipeline', 'azure-devops', 'xamarin', 'ios', 'azure', 'continuous deployment']"
20,How to run successfully Protractor e2e test in Cloud Builders?,"['google-cloud-platform', 'docker', 'continuous-integration', 'continuous deployment', 'protractor', 'selenium']"
21,Is there an sFTP (SSH FTP) for passwords task in Azure DevOps?,"['ssh', 'powershell', 'azure-devops', 'tfs', 'devops']"
22,NodeJs app to improve Continuous integration process. recommended? / guidelines,"['continuous deployment', 'jenkins', 'node.js', 'continuous-integration']"
23,Azure ARM template Deployment to Azure Data Factory using Azure DevOPS CI/CD? Incremental deployment?,"['continuous deployment', 'azure-data-factory', 'azure-devops']"
24,Errors when Pushing Vue.js app with IBM Cloud+Cloud Foundry Node Buildpack,"['continuous-delivery', 'continuous deployment', 'vue.js', 'cloudfoundry', 'ibm-cloud', 'npm-install']"
25,When are ARM templates used in the deployment process?,"['continuous deployment', 'azure-devops']"
26,How to separate serverless code from local server code,"['aws-codebuild', 'serverless', 'git', 'continuous deployment', 'amazon-web-services']"
27,Cloud code debug get disconnected automatically after some,"['continuous deployment', 'vscode-debugger']"
28,React SPA dynamic environment configuration,"['continuous deployment', 'docker', 'reactjs', 'deployment']"
29,Which username &#39;etckeeper&#39; uses to push?,"['version', 'rhel7', 'linux', 'git']"
30,CI/CD pipeline deployment of AngularJS1.5.11 to azure websites giving error &quot;Failed to instantiate module app.core due to Unknown provider: ENV_VARS&quot;,"['azure-devops', 'continuous-deployment', 'azure', 'continuous deployment', 'angular-module', 'angularjs']"
31,Conditions in Bitbucket Pipelines,"['continuous deployment', 'continuous-deployment', 'kubernetes', 'bitbucket-pipelines']"
32,PHP application deployment failed on Google App Engine,"['continuous deployment', 'php', 'google-app-engine', 'google-cloud-platform']"
33,Handling kafka clients updates in kubernetes,"['continuous deployment', 'go', 'kubernetes', 'apache-kafka']"
34,How to continuously deploy from jenkins to Kubernetes,"['continuous deployment', 'gitlab', 'jenkins', 'kubernetes']"
35,Capistrano &quot;Not a tty&quot;,"['capistrano3', 'continuous deployment', 'capistrano', 'gitlab-ci']"
36,Is there a way to 1/ enable CD 2/ change runtime properties for running Azure Container Instances,"['continuous deployment', 'continuous-deployment', 'azure-container-instances']"
37,Unable to deploy Angular 5 + Node app to heroku,"['web-deployment', 'heroku-cli', 'node.js', 'heroku', 'continuous deployment', 'angular5']"
38,How to pass environment variables from Azure build pipeline to release pipeline,"['docker-compose', 'azure-devops', 'docker', 'azure', 'continuous deployment']"
39,How to run Jenkins Pipeline conditional stage on specific node?,"['continuous deployment', 'jenkins-pipeline', 'continuous-deployment']"
40,Selenium cannot get webpage content on Linux but work well on Windows for a specific website,"['python', 'continuous deployment', 'selenium-webdriver', 'selenium', 'linux']"
41,Deploying an existing Azure container from the registry using a TFS build,"['azure-devops', 'containers', 'docker', 'azure', 'continuous deployment']"
42,How do I determine if a build is a scheduled job in CircleCI?,"['cron', 'circleci', 'scheduled-tasks']"
43,AWS ECS Continuous Deployment issue with CodePipeline,"['continuous deployment', 'amazon-web-services', 'amazon-ecs']"
44,Deploying code changes to IoT devices without direct access to it,"['continuous deployment', 'iot', 'continuous-deployment']"
45,Share a folder between two jobs in CircleCI,"['continuous deployment', 'circleci']"
46,Continuous Deployment Pipeline in aws,"['amazon-elastic-beanstalk', 'asp.net-core', 'continuous-deployment', 'continuous deployment', 'amazon-web-services']"
47,Google Apps Script to run Javascript on GMail Inbox,"['google-apps-script', 'gmail', 'continuous deployment', 'gmail-addons', 'javascript']"
48,Images are not displayed after publishing the bot with continuous deployment,"['wwwroot', 'azure-web-app-service', 'continuous-integration', 'continuous deployment', 'botframework', 'github']"
49,"Why does my karma-config.js triggers multiple launches of karma, with only the first working?","['angular-cli', 'karma-chrome-launcher', 'circleci', 'circleci-2.0', 'karma-runner', 'angular']"
50,Google Dataflow: get job name and start time from the running pipeline itself,"['google-cloud-dataflow', 'continuous deployment', 'apache-beam']"
51,Azure Functions not showing up in Function app in portal,"['continuous deployment', 'azure-functions', 'azure']"
52,Gatsby Build Fails on Netlify Deploy,"['gatsby', 'continuous deployment', 'reactjs', 'netlify']"
53,Continuously deploy (CD) SignalR console app to Azure App Services,"['azure-devops', 'azure-web-app-service', 'docker', 'azure', 'continuous deployment', 'azure-webjobs']"
54,Kubernetes cron job needs to get tag from prod rather than latest?,"['continuous deployment', 'kubernetes']"
55,Netlify Continuous Deployment Issue,"['continuous deployment', 'vue.js', 'netlify']"
56,Install a Git branch as npm dependency and a Git branch as npm DEV dependency,"['continuous deployment', 'git', 'npm']"
57,Get Gmail API refresh token without user intervention,"['gmail-api', 'google-api', 'circleci', 'authorization']"
58,In Azure DevOps how can I configure my pipeline so that I could easily trigger it for the source code in a different branch?,"['continuous deployment', 'azure-pipelines', 'azure-devops']"
59,Azure scale set ARM template redeployment resets node count,"['azure-resource-manager', 'continuous deployment', 'azure']"
60,"How to fix &quot;SyntaxError: Expected &quot;#&quot;, &quot;\n&quot;, &quot;\r&quot; or [ \t] but &quot;[&quot; found.&quot; which is retrieved by yargs module?","['toml', 'node.js', 'yargs', 'continuous deployment', 'bitbucket-pipelines', 'mocha']"
61,Azure devops : Continuous deployment for sql script,"['sql', 'azure-devops', 'continuous-deployment', 'sql-server', 'continuous deployment']"
62,How to prevent cloud build from running builds in parallel?,"['continuous deployment', 'google-cloud-build']"
63,How can I tell a Bitbucket pipeline not to override my s3 folder?,"['continuous deployment', 'amazon-s3', 'git', 'bitbucket-pipelines']"
64,Audio Chatbot: Not getting Sound while playing audio on user browser after deploying while running fine on my PC,"['python-3.x', 'reactjs', 'continuous deployment', 'speech-recognition', 'text-to-speech', 'javascript']"
65,Vue: Having frontend in it&#39;s own Github repo?,"['continuous deployment', 'laravel', 'vue.js']"
66,Context variable for Jekyll in Netlify,"['jekyll', 'continuous deployment', 'netlify']"
67,Spring boot war consuming lot of memory,"['continuous deployment', 'tomcat8', 'war', 'spring-boot']"
68,Azure Build Pipeline: How to include additional project in artifact?,"['continuous deployment', 'build-pipeline', '.net', 'azure-devops']"
69,Where does that msdeploy.axd?site= param value come from?,"['continuous deployment', 'msdeploy', 'msbuild', 'azure-devops']"
70,How to fix NullPointer error in MessageFlusher.sendMessagesToSubscriptions(MessageFlusher.java:146),"['wso2-am', 'continuous deployment', 'wso2']"
71,GOCD Nexus plugin don&#39;t recognize packages,"['nexus', 'continuous deployment', 'go-cd', 'continuous-deployment']"
72,Deploying Azure webjobs,"['continuous deployment', 'azure', 'azure-webjobs']"
73,Does Celery task code need to exist on multiple machines?,"['continuous deployment', 'celery']"
74,Cannot acces Storage account in release task AzureBlob File Copy,"['continuous deployment', 'azure-pipelines', 'azure', 'azure-devops']"
75,How do I deploy continuous azure webjob using Octopus deploy,"['continuous deployment', 'azure-webjobs-continuous', 'octopus-deploy']"
76,Continuous Deployment of a NodeJS using GitLab Ask Question,"['node.js', 'heroku', 'gitlab', 'continuous-deployment', 'continuous deployment', 'javascript']"
77,Is it possible to deploy an Azure Web App based on a public git repo using only an ARM template?,"['continuous deployment', 'azure-web-app-service', 'azure', 'azure-git-deployment']"
78,Flink 1.7 Savepoints in a Flink job cluster,"['continuous deployment', 'flink-streaming', 'apache-flink']"
79,Why does enabling the Cloud Run API create so many service accounts? Why do they have so many privileges?,"['continuous deployment', 'google-cloud-run', 'google-cloud-platform']"
80,"Azure Function deployed successfully, but not working","['azure-devops', 'continuous deployment', 'azure-functions', 'azure-pipelines-release-pipeline', 'azure-pipelines']"
81,Publish azure webjob from dotnet cli,"['continuous deployment', 'visual-studio-2019', 'azure-webjobs', 'dotnet-cli']"
82,Is it possible to setup Continuous Integration &amp; Continuous Deployment for iOS app development?,"['ios', 'continuous-deployment', 'continuous-integration', 'continuous deployment', 'xcode', 'macos']"
83,Activate retry in firebase cloud function programmatically,"['google-cloud-firestore', 'continuous deployment', 'google-cloud-functions', 'firebase']"
84,dotnet semantic versioning in a continuous deployment environment,"['dotnet-cli', 'semantic-versioning', 'gitlab', 'csproj', 'continuous deployment', '.net-core']"
85,How can I grant roleAssignement/write permission to azure devops service connection,"['azure-devops', 'azure', 'azure-cli', 'continuous deployment', 'hcl']"
86,Enabling CI/CD for Netflix OSS,"['netflix', 'netflix-zuul', 'netflix-eureka', 'continuous deployment', 'netflix-ribbon', 'devops']"
87,How to combine continuous deployment and testing with scheduled testing of latest release,"['continuous deployment', 'azure-pipelines-release-pipeline', 'azure-pipelines', 'azure-devops']"
88,Kubernetes Helm chart initiation with Kubernetes cluster,"['kubectl', 'continuous deployment', 'kubernetes']"
89,How to integrate Bitbucket Pipelines with firebase hosting for a create-react-app?,"['reactjs', 'continuous-integration', 'continuous deployment', 'firebase', 'firebase-hosting', 'bitbucket']"
90,Continuous deployment of a django server,"['continuous deployment', 'web-deployment', 'continuous-deployment', 'django']"
91,"&quot;Test in Web Chat&quot; not working now, but was working fine 2 days back","['azure-bot-service', 'continuous deployment', 'c#']"
92,Purpose of the master branch when branching by rule,"['version-control', 'branch', 'git', 'continuous deployment', 'trunk', 'merge']"
93,How to create deployments with more than one pod?,"['continuous deployment', 'google-cloud-platform', 'kubernetes']"
94,NLTK and cx_Freeze issues,"['python', 'nltk', 'python-3.x', 'continuous deployment', 'cx-freeze']"
95,Bitbucket is not authorizing Azure for continuous deployment,"['bitbucket', 'continuous deployment', 'azure', 'deployment']"
96,"How do I safely modify class properties in, and return them from, separate threads?","['python', 'python-decorators', 'oop', 'continuous deployment', 'python-multithreading']"
97,AWS EKS Cluster Autoscaler - Scale-In Policy,"['aws-eks', 'continuous deployment', 'kubernetes', 'autoscaling']"
98,Automatically triggering an Azure release pipeline,"['azure-pipelines-build-task', 'continuous deployment', 'angular', 'azure-pipelines-release-pipeline', 'azure-pipelines']"
99,Pelican site on Netlify,"['continuous deployment', 'netlify', 'pelican']"
100,Kubernetes Zero Downtime deployment not working - Gives 503 Service Temporarily Unavailable,"['continuous deployment', 'kubernetes']"
101,CI/CD for Dell Boomi,"['boomi', 'continuous deployment', 'continuous', 'deployment']"
102,Access kubernetes docker for desktop from jenkins,"['continuous deployment', 'jenkins', 'docker', 'kubernetes']"
103,Install the IIS ASP.NET Core module via Powershell,"['continuous deployment', 'asp.net-core', 'iis', 'asp.net']"
104,Getting continuous info on the console when executing a command launched from within node,"['continuous deployment', 'node.js']"
105,Automatically syncing develop with master on merge,"['gitlab-ci', 'continuous deployment', 'gitlab', 'git']"
106,Generating GUIDs for Wix MSI files in Azure DevOps,"['azure-devops', 'git', 'guid', 'continuous deployment', '.net', 'wix']"
107,Terraform Create a New EBS Snapshot on each Terraform apply,"['continuous deployment', 'terraform', 'continuous-deployment']"
108,NodeJS environment variables on Google App Engine and Travis CI,"['environment-variables', 'node.js', 'travis-ci', 'continuous deployment', 'google-app-engine']"
109,Deploy a web app to Azure App Services - Using a Resource Manager connection,"['azure-resource-manager', 'build-pipeline', 'continuous-deployment', 'azure', 'continuous-integration', 'continuous deployment']"
110,Jenkins Python job fails with &quot;ImportError...&quot; but builds successfully on identical branch,"['python', 'git', 'continuous deployment', 'jenkins', 'bitbucket']"
111,Metric name for &quot;Count of dead-lettered messages in a Queue/Topic. (Preview)&quot; Azure,"['azure-devops', 'azure', 'azureservicebus', 'continuous deployment', 'azure-servicebus-topics']"
112,404 with React Router that I cannot reproduce locally,"['react-router', 'continuous deployment', 'reactjs']"
113,Google Cloud Architect practice exam query,"['continuous deployment', 'google-app-engine', 'google-cloud-platform', 'google-cloud-datastore']"
114,Cannot convert an Objective-C private property into an instance variable,"['metal', 'continuous deployment', 'objective-c', 'ios']"
115,Continuous integration always fails with VERR_VMX_NO_VMX,"['vagrant', 'packer', 'travis-ci', 'continuous-integration', 'continuous deployment', 'virtualbox']"
116,Data Factory Continuous Integration Deployment - Issue with IR when AAD authentication with managed identity used,"['continuous deployment', 'azure-data-factory-2', 'azure-data-factory']"
117,"How to stop and restart Golang app, Nginx, and Systemd from Travis CI","['continuous-deployment', 'continuous deployment', 'travis-ci', 'digital-ocean']"
118,pulling a git repo at a particular commit in python setup.py file,"['python', 'continuous deployment', 'setup.py', 'python-packaging']"
119,Need advice with gitLab-runner for continuous deployment,"['continuous deployment', 'gitlab-ci-runner', 'gitlab']"
120,What is a good usecase for using Continuous Integration &amp; Continuous Deployment?,"['continuous-delivery', 'continuous-deployment', 'continuous-integration', 'continuous deployment', 'automated-tests']"
121,"How to setup Multiple Environment (Dev,stage,Prod) using Jenkins?","['continuous deployment', 'jenkins', 'docker', 'devops']"
122,How to fix &#39;Could not find ____ in any of the sources&#39; on Rails project CI?,"['circleci', 'ruby-on-rails']"
123,How to fix &#39;EXCEPTION CAUGHT BY WIDGETS LIBRARY&#39; and skipping frames?,"['flutter-test', 'android-studio', 'ubuntu', 'flutter']"
124,How to use firebase continous deployment with cloudbuild?,"['continuous deployment', 'google-cloud-build', 'firebase-cli', 'firebase']"
125,AWS Lambda function deployment using Shippable CI with mentioned specific version and alias,"['serverless', 'shippable-ci', 'continuous-deployment', 'continuous deployment', 'amazon-web-services', 'aws-lambda']"
126,How can I rollout changes to my instances when using docker-compose?,"['google-cloud-platform', 'continuous-deployment', 'docker', 'continuous deployment', 'google-cloud-build']"
127,Azure DevOps Continuous Integration with asp.net website project instead of web application,"['continuous deployment', 'azure-devops', 'c#']"
128,aws ecs ec2 continuous deployment with jenkins,"['jenkins-pipeline', 'continuous-deployment', 'docker', 'continuous deployment', 'jenkins', 'amazon-ecs']"
129,Why is same command for selecting files locally not working in CircleCI?,"['ruby', 'circleci']"
130,Deploying multiple apps on app engine with travis - openssl problem,"['continuous deployment', 'google-cloud-platform', 'travis-ci', 'openssl']"
131,Azure DevOps Release not getting created with Continuous deployment trigger switched on,"['continuous deployment', 'azure-devops']"
132,MSbuild fails when Using MS.Extns.DependencyInjection and MS.Extns.Logging on non dotnet core project (.net fx 4.6.2) due to assembly conflicts,"['asp.net-web-api2', 'ms-extensions-logging', 'continuous deployment', 'dependency-injection', 'entity-framework-6', 'msbuild']"
133,Updating Version number in DB after doing a Build or Rebuild in C#,"['continuous deployment', 'versioning', 'msbuild', 'automatic-updates']"
134,Continuous deployment to Play Store For Native Application,"['nativescript', 'circleci', 'continuous-deployment', 'continuous deployment', 'android']"
135,Continuous Deployment with TeamCity 2018 In Windows 10,"['continuous deployment', 'teamcity', 'continuous-deployment']"
136,How to create a pipeline to publish a jar file to sharepoint?,"['azure-pipelines', 'java', 'devops', 'azure-devops']"
137,Launch kestrel or IIS Server in test setup of a unit test project,"['integration-testing', 'nunit', 'asp.net', 'continuous-integration', 'continuous deployment']"
138,How to implement the strategy of 1 database per developer for Prisma and GraphQL,"['database', 'continuous deployment', 'development-environment']"
139,Kubernetes kube-dns restarts on master node,"['continuous deployment', 'ubuntu-16.04', 'kubernetes', 'kube-dns']"
140,"Flask, SocketIO, and Docker net::ERR_CONTENT_LENGTH_MISMATCH","['python', 'flask-socketio', 'flask', 'docker', 'continuous deployment']"
141,Automate Extended Validation (EV) code signing with mage.exe,"['wpf', 'continuous-deployment', 'continuous deployment', 'mage', 'clickonce', 'signtool']"
142,GitHub Google Cloud Build - Multiple Repositories,"['continuous deployment', 'google-cloud-build', 'github', 'continuous-integration']"
143,Kentico Continuous Integration - Login failed for user,"['continuous deployment', 'kentico']"
144,Continuous deployment in Container web app not working,"['azure-container-registry', 'continuous-deployment', 'azure', 'azure-web-app-for-containers', 'continuous deployment', 'webhooks']"
145,Update Existing Lambda Function Using AWS Continuous Integration/Deployment,"['aws-codebuild', 'continuous deployment', 'aws-codepipeline', 'amazon-web-services', 'amazon-cloudformation', 'aws-lambda']"
146,Azure function deployed using azure devops still using old code,"['continuous deployment', 'azure-functions', 'azure-devops']"
147,"Problem issues about publishing a bot from Visual Studio 2017 to Azure App Services, no errors but doesn&#39;t work at all","['continuous deployment', 'botframework', 'c#']"
148,Azure App Service Continuous Deployment Webhook doesn&#39;t work,"['azure-web-app-service', 'continuous-deployment', 'docker', 'azure', 'continuous deployment', 'webhooks']"
149,Liquibase Rollback Strategy for CI/CD,"['cd', 'tags', 'liquibase', 'continuous-integration', 'continuous deployment']"
150,Should I create message channel at runtime?,"['continuous deployment', 'google-cloud-platform', 'google-cloud-pubsub']"
151,gitlab react docker: npm not found,"['dockerfile', 'pipeline', 'gitlab', 'reactjs', 'continuous-integration', 'continuous deployment']"
152,Cloudformation giving error &quot;Requires capabilities : [CAPABILITY_AUTO_EXPAND]&quot;,"['continuous-deployment', 'continuous deployment', 'jenkins', '.net', 'amazon-cloudformation', 'aws-lambda']"
153,"When continuously deploying to staging, what happens when you swap staging and production deployment slots?","['continuous deployment', 'azure-deployment', 'azure']"
154,Is it possible to deploy a Qt app to Mac OS without a Mac?,"['continuous deployment', 'qt']"
155,Node.js heap snapshot filled with strings of old versions of code,"['continuous deployment', 'heap-memory', 'node.js', 'memory']"
156,No node_modules from netlify deploy,"['continuous deployment', 'npm-install', 'netlify']"
157,"Azure App Service Kudu Continuous Deployment stopped working, not even showing latest commits","['kudu', 'azure-web-app-service', 'continuous-deployment', 'azure', 'continuous deployment']"
158,Optimize continuous deployment (cancel throu chain-of-responsibility),"['tomcat', 'continuous-delivery', 'continuous-deployment', 'continuous deployment', 'java', 'maven']"
159,Implementation of CD with Jenkins for on premise kubernetes cluster?,"['kubernetes', 'continuous-deployment', 'continuous deployment', 'jenkins', 'jenkins-plugins']"
160,Gradle 5.3 publish SNAPSHOT BadRequest Error,"['maven', 'circleci', 'gradle', 'nexus']"
161,Circleci and GoBuffalo challenge,"['buffalo', 'go', 'circleci']"
162,Run first circleci config from feature branch [No configuration was found in your project],"['circleci-workflows', 'circleci', 'continuous-integration', 'circleci-2.0', 'github']"
163,GAE site has new exception since deploy: &quot;Cannot read property &#39;parsePath&#39; of undefined&quot;,"['google-app-engine', 'google-cloud-platform', 'circleci']"
164,How to gradually shift current Django unit tests to pytest?,"['python', 'circleci', 'django', 'pytest', 'pytest-django', 'unit-testing']"
165,How to generate a file with env vars in a job in Circleci config.yml,"['circleci-2.0', 'circleci', 'shell', 'bash']"
166,How to run java10 inside Docker of python3.7?,"['python', 'docker', 'circleci', 'java']"
167,How to fix CircleCI Permission Denied error when test runs,"['circleci', 'ruby-on-rails']"
168,"Run pylint for both python 2.7 and 3.7, in pre-commit hook on Docker image","['python', 'pylint', 'pre-commit', 'circleci']"
169,How to write to $BASH_ENV with echo command using an existing environment variable?,"['linux', 'circleci', 'bash']"
170,SQL Server database keeps setting SINGLE_USER on in tests,"['single-user', 'docker', 'circleci', 'sql-server']"
171,This type of step does not support compressed syntax,['circleci']
172,aws-cdk - ApiGateway with Cognito authorizer for a Lambda proxy endpoint,"['aws-api-gateway', 'amazon-web-services', 'circleci', 'aws-cdk']"
173,bundler: failed to load command: fastlane (/home/circleci/.rubies/ruby-2.6.1/bin/fastlane),"['fastlane', 'android', 'circleci', 'aws-device-farm']"
174,CircleCI failing to run flask tests that are running locally,"['python', 'flask', 'circleci', 'docker', 'continuous-integration']"
175,CircleCI doesn&#39;t import dependency,"['composer-php', 'php', 'circleci']"
176,WebDriverException selenium-python tests on CircleCi,"['python', 'python-3.x', 'circleci', 'pytest', 'circleci-2.0', 'selenium-webdriver']"
177,kuberntes migration job sidecar is not being terminated,"['kubernetes', 'kubectl', 'google-cloud-platform', 'circleci', 'jenkins']"
178,CircleCI 2.0 : Error unmarshaling return header; nested exception is:,"['circleci', 'circleci-2.0', 'android-espresso', 'kotlin', 'android']"
