s.no,msg,old_tags
1023,Why is this GET request not being cached by the browser?,"['web', 'browser', 'html', 'google-chrome', 'image api', 'caching']"
1024,How to add my custom error on &quot;/api&quot; documentation api-platform,"['api-platform.com', 'error-handling', 'symfony', 'image api']"
1025,What is the overview for building Unity/Hololens navigation,"['hololens', 'hololens-emulator', 'unity3d', 'c#', 'image api']"
1026,How to upload featured image to existing post in rest API,"['wordpress', 'image api']"
1027,Filepond process all files in one request,"['file-upload', 'filepond', 'reactjs', 'image api', 'javascript']"
1028,Issues to build apk with qt creator [Solve],"['qml', 'qt-creator', 'image api', 'qt', 'c++', 'android']"
1029,api saving multiple children records only save one with missing fields ruby,"['rails-api', 'ruby-on-rails', 'image api', 'ruby']"
1030,Is there any way to get the display pic of any user by using their email/gmail id?,"['node.js', 'email', 'url', 'image api', 'image']"
1031,Insert value in the next column so that it does not match 2 previous column in a table?,"['algorithm', 'sql', 'sql-server', 'java', 'image api']"
1032,How to train Faster RCNN with InceptionResentV2 on high resolution images?,"['object-detection-api', 'keras', 'tensorflow', 'image api']"
1033,&lt;p&gt; content is overflowing the div in ie11,"['css', 'flexbox', 'internet-explorer-11', 'image api']"
1034,Referencing a revoked object URL,"['html', 'javascript', 'image api']"
1035,Error passing data from parent to child component on different routes in vue js,"['vue.js', 'javascript', 'image api', 'vuejs2']"
1036,Getting Black Screenshots with Windows API,"['windows', 'winapi', 'image api', 'c++']"
1037,How to download GeoTiff files from GeoServer using Python,"['python', 'wcs', 'tiff', 'geoserver', 'image api']"
1038,Angular 7 and FormData,"['ionic-framework', 'javascript', 'image api', 'angular']"
1039,How can I send a pdf file or any document to a server from my Android app?,"['web-services', 'android', 'image api']"
1040,carousel images aren&#39;t loading -Xcode Swift,"['swift', 'ios', 'icarousel', 'image api', 'xcode']"
1041,How to update collection documents efficiently when changing a specific value in Firestore?,"['google-cloud-firestore', 'firebase', 'image api', 'swift']"
1042,How can I upload images with PHP using Prestashop?,"['prestashop-1.7', 'php', 'image api', 'image', 'prestashop']"
1043,Weather graph component in react application,"['charts', 'reactjs', 'image api', 'd3.js']"
1044,&quot;Now dev&quot; won&#39;t work with Create React App. This Zeit Now command gives me &quot;Error! Failed to detect a server running on port &lt;#&gt;&quot;,"['node.js', 'reactjs', 'zeit-now', 'express', 'image api', 'javascript']"
1045,How Can I get My Social Preview Image Link of My Github Repo using Git API or Any Logic?,"['github-api', 'image api', 'github']"
1046,Problem to deploy a node / express API using now.sh,"['node.js', 'deployment', 'express', 'image api', 'typescript']"
1047,Using httpClient.postasync for web api calls .netcore,"['asp.net-web-api2', 'httpclient', 'asp.net-core', 'razor-pages', 'image api', '.net-core']"
1048,Microsoft Azure Face Comparison,"['microsoft-cognitive', 'image api', 'c#']"
1049,Integrate map as banner in Nativescript/angular 8,"['nativescript', 'image api', 'angular']"
1050,image not upload on server with file-transfer plugin ionic3,"['file-transfer', 'ionic3', 'image api', 'image-uploading']"
1051,"can&#39;t get selected dropdown and show data with select2, axios vue with laravel","['jquery-select2', 'laravel', 'vue.js', 'image api', 'axios']"
1052,Cross-origin request with JavaScript (OAuth-Client),"['request', 'cross-domain', 'zendesk', 'api', 'image api', 'javascript']"
1053,Could not connect mssql with django,"['python', 'sql-server', 'django', 'image api', 'django-models', 'pymssql']"
1054,How to handle additional multer file uploads from a NodeJS API perspective?,"['mongodb', 'multer', 'node.js', 'mongoose', 'api', 'image api']"
1055,Fine Tuning Direction Information for User,"['swift', 'ios', 'image api', 'direction', 'google-maps']"
1056,"Docker Nginx cannot get logging to record to drive, not stdout/stderr","['nginx', 'stderr', 'logging', 'docker', 'image api']"
1057,Basic Traefik configuration issue,"['traefik', 'image api']"
1058,How to fix a Recyclerview that doesn&#39;t scroll smoothly?,"['android', 'android-recyclerview', 'image api', 'kotlin']"
1059,How to send a multipart/form-data request in Swift to this API snippet,"['swift', 'multipartform-data', 'image-upload', 'image api', 'javascript']"
1060,Getting Error 413 when attach image in the http request to node server in ionic 3,"['ionic-framework', 'ionic3', 'image api']"
1061,Exporting data over an api from s3 using lambda,"['amazon-s3', 'aws-lambda', 'image api']"
1062,Error in saving an array of images sent from front-end to Django backend,"['python', 'filefield', 'django-rest-framework', 'django', 'imagefield', 'image api']"
1063,Is it possible to comment with an upload?,"['linkedin-api', 'image api', 'linkedin']"
1064,How to get the response from api call and use that same response in other endpoints in .netcore?,"['rest', 'image api', '.net-core']"
1065,TensorFlow/Keras: How to get meaningful loss values from my generalized dice loss function?,"['python', 'keras', 'loss-function', 'image api', 'tensorflow']"
1066,multiple api calls in vue and each using info. fetched from previous call,"['api', 'vue.js', 'javascript', 'image api']"
1067,Select image from Gallery with path not working?,"['android-image', 'android-fileprovider', 'image api', 'android-gallery', 'image']"
1068,Uploading image file to AWS Lambda .Net Core application from browser results in unusable file - how to fix?,"['imagesharp', 'amazon-web-services', 'image api', '.net-core', 'aws-lambda']"
1069,Tensorflow Dataset Interleave Image File Paths for Reading,"['tensorflow-datasets', 'image api']"
1070,How to retrieve all images in mongoDB to display react app,"['mongodb', 'node.js', 'reactjs', 'gridfs', 'image api']"
1071,How to send JWT header when using Stripe checkout,"['node.js', 'html', 'image api', 'stripe-payments', 'javascript']"
1072,"How to make a D3 SVG fill to fit area on screen, and have graph fill area of SVG?","['svg', 'javascript', 'image api', 'd3.js']"
1073,How to get access to Google Drive video and images by using OAuth 2.0 for TV and Limited-Input Device Applications?,"['television', 'oauth-2.0', 'image api', 'google-drive-api']"
1074,What is the difference of F5 to Ctrl+F5 in matter of load times?,"['ajax', 'google-chrome', 'image api']"
1075,How to make html markup show up?,"['python', 'html', 'image api', 'flask']"
1076,using React can I prevent sending empty strings from my inputs to my mongodb database during update?,"['node.js', 'reactjs', 'image api']"
1077,Upload set of images to net core server from Xamarin.Forms app,"['asp.net-core-webapi', 'asp.net-core', 'c#', 'image api', '.net-core']"
1078,How to choose picture from gallery and display it in CardView when Button inside the same CardView of ReclerView is pressed,"['onactivityresult', 'android-recyclerview', 'android-viewholder', 'image api', 'android-adapter', 'android']"
1079,How to execute a jmeter jmx file from a standard docker container?,"['docker', 'image api', 'jmeter']"
1080,"Request GET method to get image works in local, but not testing / production environment, what do I have to consider in the live environments?","['node.js', 'request', 'image api', 'http']"
1081,&quot;Create a Playlist&quot; with Spotify Web API returning 201 but without a playlist object,"['fetch-api', 'spotify', 'async-await', 'http', 'image api', 'javascript']"
1082,Wordpress REST API - Image not showing up,"['wordpress', 'wordpress-rest-api', 'php', 'image api', 'cors', 'javascript']"
1083,Run processes in parallel while capturing video with opencv,"['python', 'opencv', 'multithreading', 'image api']"
1084,Tensorflow serving performance slow,"['tensorflow-serving', 'tensorflow', 'image api']"
1085,Displaying image from the database in MVC,"['base64', 'c#', 'html', 'binary-data', 'image api', 'image']"
1086,Size of the uploaded image using multipart form data in Web API,"['multifile-uploader', 'multipartform-data', 'asp.net-web-api', 'image api', 'asp.net-mvc']"
1087,Point Cloud triangulation using marching-cubes in Python 3,"['marching-cubes', 'scikit-image', 'image api', 'python-3.x']"
1088,Redirecting user based on his authentication,"['react-native', 'axios', 'image api']"
1089,How to display number of epochs in tensorflow object detection api with Faster Rcnn?,"['python', 'object-detection-api', 'tensorflow', 'image api']"
1090,HttpClient POST to Web API returns 400 Bad Request,"['wpf', 'asp.net-core', 'c#', 'asp.net-web-api', 'image api']"
1091,Write to Secret file in pod,"['image api', 'kubernetes']"
1092,Unable to connect to local Sql server from Docker swarm node,"['docker-swarm', 'docker', 'image api', 'docker-machine']"
1093,How to set a value in a field according the item selected in the picker?,"['react-native', 'image api', 'picker']"
1094,connecting dialogflow to mysql database for inserting data into mysql tables,"['mysql', 'node.js', 'image api', 'webhooks', 'dialogflow']"
1095,How to include FormData in Angular POST body to retrieve it from ASP.NET Core Backend as IFormFile,"['asp.net-core', 'http', 'c#', 'image api', 'angular']"
1096,How can use static Ip as external-IP at kubernates?,"['yaml', 'docker', 'image api', 'kubernetes']"
1097,Android kotlin volley http can not post json data,"['android-volley', 'android', 'image api', 'kotlin']"
1098,How to use REST API in Roku with BrightScript?,"['image api', 'roku']"
1099,Is there Google API to hide User details like name and profile image while accessing publically shared file?,"['google-api-client', 'image api', 'google-drive-api']"
1100,Traefik 502 bad gateway | Wrong config? | fastify nextjs,"['fastify', 'image api']"
1101,sending web push notifications and Received unexpected response code: 401 &amp; 403,"['service-worker', 'asp.net', 'c#', 'web-push', 'image api', 'webforms']"
1102,show data in tableview from core data,"['arrays', 'swift', 'core-data', 'uitableview', 'api', 'image api']"
1103,How to copy a Google sheet and get data validation to stay intact?,"['node.js', 'google-sheets-api', 'image api', 'google-sheets']"
1104,I have an api uploading bunch of images and i want a different api where i can edit the images through multer,"['multer', 'node.js', 'express', 'mongoose', 'image api', 'javascript']"
1105,Pass Environment Variables to Angular Container Docker : Post Build,"['docker', 'image api', 'angular']"
1106,How to use node.js to implement multipart/form-data in openapi3&#39;s yaml file?,"['node.js', 'openapi', 'image api']"
1107,is there an API to get all of an Instagram business account&#39;s posts that include a particular hashtag?,"['instagram-graph-api', 'image api']"
1108,Network Bandwith (Mbps) &amp; Disk I/O (MB/s) using Python (Linux/Windows),"['python', 'ubuntu', 'python-3.x', 'psutil', 'linux']"
1109,How to see when information is lost using API and Glide for images,"['android-glide', 'java', 'api', 'image api', 'stream', 'android']"
1110,Traefik not work (404) with containers inside a worker node [docker swarm],"['docker-compose', 'traefik', 'docker', 'image api', 'docker-swarm', 'docker-network']"
1111,How I can display all imagefrom Array in reactJS?,"['reactjs', 'javascript', 'image api']"
1112,PHP Post Params from Android Mess Up,"['image-uploading', 'post', 'php', 'image api', 'android']"
1113,How to store and retrieve files with MySQL for React/Node.js,"['mysql', 'node.js', 'reactjs', 'image api', 'file', 'database']"
1114,How to Integrate Instagram API (Feed) in Laravel 5.8?,"['laravel-5', 'php', 'instagram-api', 'image api']"
1115,Visual Studio 2017/Xamarin Android Emulator &quot;Object reference not set to instance of an object.&quot; when attempting to test starter program,"['xamarin.forms', 'image api', 'visual-studio-2017', 'android-sdk-manager', 'android']"
1116,Is it possible to set class members through fetch() so they can be used in other class methods?,"['promise', 'fetch', 'image api', 'javascript', 'class']"
1117,OpenGapps using Android Studio,"['android-emulator', 'android-studio', 'image api', 'android-sdk-2.3', 'android']"
1118,Blurry Map images using Here Maps API on mobile,"['here-api', 'image api']"
1119,Custom MKAnnotationView want to be tapped again,"['mapkit', 'image api', 'swift', 'mkannotationview']"
1120,Can&#39;t send to api controller. ASP.NET Core + Angular 7,"['asp.net-core', 'image api', 'angular']"
1121,How to render ajax response to view,"['ajax', 'laravel', 'image api']"
1122,Vala - Change file permissions to a image downloaded from Unsplash API,"['vala', 'gtk3', 'elementary', 'gtk', 'image api', 'file']"
1123,Calling external api from spring boot with multipart/form-data,"['multipartform-data', 'java', 'image api', 'spring-boot', 'spring']"
1124,Is there a way to get a QR code image with Google Apps Script using the POST method of the Google Charts API?,"['google-apps-script', 'post', 'google-visualization', 'image api', 'qr-code', 'charts']"
1125,React Native just crashes after splash screen,"['reactjs', 'image api', 'react-native']"
1126,AsyncHttpClient won&#39;t let program exit,"['java', 'asynchronous', 'image api']"
1127,Fix Problem Reading Properties of an Object Event Though They Can Be Logged,"['javascript-objects', 'typeerror', 'arrays', 'image api', 'properties', 'javascript']"
1128,In S3 should a second generated URL be created for a 3rd party API callback?,"['node.js', 'amazon-s3', 'api', 'image api', 'pre-signed-url']"
1129,Android build suddenly starts failing with : resource android:attr/fontVariationSettings not found,"['android', 'build.gradle', 'image api', 'gradle']"
1130,Cloudinary in React/Redux &quot;blocked by CORS policy&quot;. Request header field authorization,"['reactjs', 'cloudinary', 'express', 'image api', 'cors']"
1131,Can not update or save settings on SonarQube behind Nginx reverse proxy,"['nginx', 'sonarqube', 'docker', 'image api', 'reverse-proxy']"
1132,Problem running docker image for my django-rest-framework api with gunicorn,"['gunicorn', 'docker', 'image api', 'django-rest-framework']"
1133,Chrome - Images disappearing from cache storage after few hours,"['web-worker', 'cachestorage', 'google-chrome', 'image api', 'progressive-web-apps']"
1134,Gradle build failing for Android Studio without any code changes,"['maven', 'android', 'image api', 'gradle']"
1135,Tensorflow SSD Networks will not converge,"['python', 'tensorflow', 'image api']"
1136,Is there a downside to allocating a large chunk all at once with mmap or sbrk for a custom allocator in linux,"['linux-kernel', 'unix', 'linux']"
1137,Identical examples in Tensorflow object detection API,"['python', 'image api', 'object', 'tensorflow', 'detection']"
1138,Prometheus curl API query issue,"['curl', 'api', 'image api', 'prometheus']"
1139,"new API routes give 404 on nginx server, why?","['nginx', 'laravel', 'image api', 'routes']"
1140,How to open android sdk 24 manager,"['python', 'kivy', 'buildozer', 'image api']"
1141,How to deploy a Camunda process while building a Docker image,"['camunda', 'dockerfile', 'docker', 'image api']"
1142,How to disable scrolling through AMPHTML slides?,"['amp-html', 'google-web-designer', 'image api']"
1143,Windows compatibility: Permissions?,"['dockerfile', 'docker', 'image api']"
1144,"Graphs are not created, model.ckpt-500 not found and several problems","['machine-learning', 'tensorflow', 'image api']"
1145,How to get the second level of information in a REST API?,"['react-native', 'javascript', 'image api']"
1146,Editing shares content through LinkedIn API,"['linkedin-api', 'image api', 'linkedin']"
1147,Laravel temporary variable for multiple file input (images) upload from popup modal,"['laravel', 'bootstrap-modal', 'upload', 'image api', 'forms', 'javascript']"
1148,Member Variables in Class Get Blown Away When Using std::thread,"['stdthread', 'linux', 'c++11', 'valgrind']"
1149,Linker errors even though CMake correctly locates the relevant .so file,"['makefile', 'cmake', 'linker', 'linux', 'boost']"
1150,Get images with Axios from API and save as files,"['es6-promise', 'image api', 'twitter', 'javascript', 'axios']"
1151,Changing ListView to RecycleView in Kivy gives the error AttributeError: &#39;list&#39; object has no attribute &#39;get&#39;,"['python', 'kivy', 'kivy-language', 'image api']"
1152,Docusaurus page not rendering,"['nginx', 'docusaurus', 'nginx-config', 'image api']"
1153,How to load network image with redirect url?,"['image api', 'flutter']"
1154,What is the best practice on how many Microservice be deployed in a container in Azure App Service,"['azure-devops', 'azure-web-app-service', 'containers', 'image api', 'azure-app-service-envrmnt']"
1155,How to retrieve an image url from Google nearby search API using retrofit in java,"['java', 'android', 'google-places-api', 'image api']"
1156,After save RuntimeError: Could not find a valid mapping for #&lt;User id,"['rails-api', 'ruby-on-rails', 'image api', 'ruby']"
1157,How to convert list of json responses to dataframe?,"['python', 'image api', 'pandas']"
1158,how to get urls from rss if title contain subSTRING?,"['parsing', 'linux', 'rss', 'bash']"
1159,Different CRC32 values from Linux and Windows with Python3,"['python', 'python-3.x', 'crc32', 'windows', 'linux']"
1160,How to rebuild an Image in Yocto with an updated Module,"['yocto', 'linux', 'bitbake']"
1161,Ways to check font encoding errors in PDF documents,"['fonts', 'linux', 'pdf', 'ghostscript']"
1162,Is there a setting that shows consecutive repetitive commands only once?,"['bash-completion', 'linux', 'shell', 'bash']"
1163,"2 level tree of n processes, how to make level 1 processes wait for all level 2 processes to finish?","['linux', 'c']"
1164,What will happen if a signal is triggered in its same trap handler?,"['linux', 'bash']"
1165,syntax error near unexpected token `(&#39; with openssl during cert generation,"['photon-os', 'openssl', 'bash', 'linux', 'certificate']"
1166,"Linux, mysql autocompletion even for small characters","['linux', 'autocomplete', 'mysql']"
1167,How to use TLS encryption?,"['ldap', 'ssl', 'linux', 'apache']"
1168,Function / alias that opens all files from glob expression,"['gnome', 'linux', 'bash']"
1169,Can not build source code of application which uses webrtc native,"['video', 'c++', 'webrtc', 'linux', 'video-streaming']"
1170,Can&#39;t locate ExtUtils/MakeMaker.pm in @INC,"['centos', 'perl', 'linux']"
1171,I have sticky bit set on a folder and want to allow individual user X to delete file in the folder created by any user,"['unix', 'csh', 'bash', 'linux', 'shell']"
1172,automatic dimming keyboard backlight in linux,"['systemd', 'dbus', 'linux', 'bash']"
1173,Executing python autogui script on ssh remote executes commands on ssh host,"['python', 'ssh', 'subprocess', 'python-3.x', 'linux']"
1174,How to get next weekday number,"['linux', 'debian', 'sh', 'date']"
1175,How to check argument equality with &#39;*&#39; wildcard in Bash?,"['glob', 'linux', 'shell', 'bash']"
1176,How can I concatenate pipeline string into file,"['linux', 'bash']"
1177,Getting ES_OUT_SET_ in cvlc when capturing h264 using the V4L2 in C++ on raspberry-pi using Logitech C920,"['v4l2', 'raspberry-pi', 'c++', 'linux', 'video-streaming']"
1178,Corrupted InnoDB still won&#39;t start even after removing corrupted tables,"['linux', 'mysql']"
1179,how program sets terminal attributes?,"['termios', 'linux', 'c', 'terminal']"
1180,How to stream &quot;dialog&quot; output to stdout?,"['python', 'bash', 'linux', 'shell', 'dialog']"
1181,How to to automatically save a copy when printing a job?,"['linux', 'google-chrome', 'cups', 'printing']"
1182,Compiling C# to get a Linux binary,"['.net', 'linux', 'c#']"
1183,Defining &amp; calling mulitiple items in a Bash script,"['linux', 'bash']"
1184,Why does this code crash with address randomization on?,"['x86-64', 'linux', 'fasm']"
1185,"Dhclient cannot renew IP lease, when IP already in use","['linux', 'dhclient']"
1186,How to store results of single bash in json file,"['linux', 'pipe', 'bash']"
1187,use rename command to batch rename the files,"['linux', 'shell']"
1188,Is there method to know which part in the process memory space is resident in memory?,['linux']
1189,How to configure nginx to run as a non-root user?,"['nginx', 'gunicorn', 'nginx-config', 'root', 'linux']"
1190,How to fix path by &quot;find&quot; which equal &quot;=&quot;?,"['linux', 'find', 'bash']"
1191,Is there a way to delete zip archive comments in python?,"['python', 'zip', 'linux', 'python-3.x']"
1192,What is the Difference Between `apt purge` and `apt remove`?,"['linux', 'apt']"
1193,Print a specific words till matched string ( pattern 2 )above the matched string ( pattern 1 ) in a file,"['linux', 'string']"
1194,Pipe pyinstaller output possible?,"['linux', 'time']"
1195,How to copy certain range of files in Linux?,['linux']
1196,Error while loading shared libraries: libopencv_highgui.so.3.4: cannot open shared object file: No such file or directory,"['shared-libraries', 'cmake', 'linux', 'opencv']"
1197,Getting superblock error after resizing disk on Red Hat 6,"['linux-kernel', 'parted', 'ext4', 'filesystems', 'linux']"
1198,What&#39;s the best alias for not having to remember the branch I&#39;m in to pull and push?,"['linux', 'git', 'scripting', 'bash']"
1199,Use icon to run Android Studio - Linux Mint,"['android-studio', 'linux', 'linuxmint']"
1200,How to distinguish between linux original commands and third-party software commands,"['node.js', 'linux']"
1201,Why I am getting missing terminating &quot; character?,"['gcc', 'linux', 'c', 'compiler-errors']"
1202,Linux/Shell slicing a large text file,"['grep', 'linux', 'awk', 'bash']"
1203,Wine KVM Subsystem for Linux,"['kvm', 'qemu', 'wine', 'windows', 'linux']"
1204,Why was a readdir function added to POSIX library interface when there is a readdir kernel function?,"['posix', 'linux', 'c']"
1205,How to replace N repeated characters in Bash?,"['string', 'opensuse', 'bash', 'replace', 'linux']"
1206,Mount point name for a docker volume,"['dockerfile', 'docker-machine', 'docker', 'mount-point', 'linux']"
1207,Adding script in Linux to display date at start up terminal bash shell,"['linux', 'bash']"
1208,How Skip press Enter to continue in shell Command using python,"['python', 'linux']"
1209,PHP connection to MongoDB not working and responding &quot;trying to get property of non value&quot;,"['amazon-ec2', 'mongodb', 'apache', 'php', 'linux']"
1210,Linux shows no GPU process but Python code showing CUDA out of memory error,"['linux', 'gpu']"
1211,Is sleep must after tcdrain()?,"['termios', 'linux', 'c', 'serial-port']"
1212,Can I install GCC8.2.0 on Cygwin? which is not in the cygwin package list,"['cygwin', 'gcc', 'clang', 'windows', 'linux']"
1213,How to measure the time in seconds between two characters while user inserting them as an input,"['time.h', 'linux', 'c', 'gettimeofday']"
1214,How to keep Vim plugins if I am not running the default vim provided by system?,"['vim', 'linux', 'vim-plugin']"
1215,Inode structure - record rec_len?,"['inode', 'linux', 'ext2']"
1216,Linux awk command to retrieve first and last row,"['linux', 'awk']"
1217,Using Protobuf installed at a custom location in Linux with CMake?,"['cmake', 'linux', 'protocol-buffers']"
1218,Visual Studio 2019 - CMake Linux - Where to get list of macros?,"['cmake', 'linux', 'visual-studio-2019', 'visual-studio']"
1219,How to skip [y/n] in shell script?,"['sh', 'linux', 'shell', 'bash']"
1220,Cannot create directory on hadoop through hadoop web console,"['hadoop3', 'linux', 'hadoop']"
1221,Invalid aliases in linux shell,"['linux', 'shell']"
1222,Container for package manager in local development with docker?,"['linux', 'composer-php', 'docker']"
1223,running docker containers on windows server,"['container-image', 'linux', 'docker', 'windows-server']"
1224,It is possible to connect with TeamViewer or AnyDesk to Linux without GUI and start GUI?,"['centos', 'centos7', 'linux', 'teamviewer']"
1225,only 1 thread possible with boost asio on machines with many cores,"['boost-asio', 'asynchronous', 'c++', 'linux', 'multithreading']"
1226,ar -x command in Linux,"['linux', 'ar']"
1227,How to get current time match with timezone changes in C,"['linux', 'c']"
1228,Not work after editing the runlevel in `/etc/init/rc-sysinit.conf`,"['linux', 'boot', 'x11']"
1229,File download of an authenticated Django Apps from a Linux core server in Python,"['python', 'django', 'linux']"
1230,Convert a docx file to PDF in linux without Libreoffice,"['python', 'docx', 'linux', 'pdf']"
1231,How to set an icon on Linux in C language (the C file) for the alone running program that does not load any external image file?,"['gcc', 'linux', 'c', 'gtk']"
1232,Why i get different md5 from Java code and linux md5sum command?,"['linux', 'java', 'md5']"
1233,If clause not working properly in cron while working OK in command line,"['cron', 'bash', 'shell', 'linux', 'sh']"
1234,Loading a TLS certificate uploaded to the Azure portal into a Linux app service container,"['azure-app-service-plans', 'asp.net-core', 'containers', 'azure', 'linux']"
1235,Using a script to Organize a file,"['linux', 'awk', 'scripting', 'bash']"
1236,How do i find all file Which as name String+Number to it Linux,['linux']
1237,Perl can&#39;t locate inline C module: &quot;Had problems bootstrapping Inline module&quot;,"['perl', 'inline', 'linux', 'c']"
