s.no,msg,old_tags
813,Azure DevOps + LibMan + UNPKG Intermittent Error LIB010: Failed to download resource from unpkg.com,"['azure-devops', 'continuous-integration', 'continuous integration', 'libman', 'msbuild']"
814,"Android project fails to build in Gitlab, even after adding local.properties file and creating ANDROID_HOME variable","['build', 'gitlab', 'git', 'continuous integration', 'gitlab-ci', 'android']"
815,What does &quot;builds&quot; mean in Continuous Integration?,"['continuous-integration', 'continuous integration']"
816,Exclude file types in CI triggers on Azure Devops Pipelines Builds,"['azure-devops', 'continuous integration']"
817,Copy Recently Modified Files with Folder Structure Using PowerShell,"['powershell', 'continuous integration']"
818,Python not recognised as command when using gitlab runner,"['python', 'gitlab-ci-runner', 'gitlab', 'git', 'continuous integration', 'gitlab-ci']"
819,Is it possible to us a csv file to connect one part of the algo to another,"['lstm', 'python-3.x', 'export-to-csv', 'continuous integration']"
820,How to tag and version automatically on build using Azure Devops and Cake Build?,"['azure-devops', 'git', 'cakebuild', 'continuous integration', 'gitversion', 'git-tag']"
821,SQL - Continuous Integration (Data),"['continuous-integration', 'validation', 'sql', 'continuous integration']"
822,Valgrind on Tensorflow Lite invoke makes it run indefinitely,"['valgrind', 'continuous integration', 'tensorflow-lite', 'c++', 'tensorflow']"
823,"How to Azure DevOps CI/CD Pipeline for PowerBuilder 2017 R3 project, is it even possible?","['azure-pipelines-build-task', 'azure-devops', 'powerbuilder', 'continuous integration', 'powerbuilder-2017']"
824,Visual Studio 2017 Window 10. All of a sudden cannot connect to MAc,"['xamarin', 'ios', 'mono', 'continuous integration']"
825,Write-Verbose vs Write-Host in powershell,"['powershell', 'continuous integration']"
826,How to configure PHPUnit to regard dataprovider error as failure and not warning?,"['phpunit', 'php', 'continuous integration']"
827,Authentication issues with django-webpack-loader with vuejs and django restframework and restauth,"['webpack', 'django-rest-framework', 'continuous integration', 'django', 'vue.js', 'django-rest-auth']"
828,How to fix &quot;ValueError: continuous format is not supported&quot; in Python (U-Net - Retinal Vessel Segmentation),"['python', 'conv-neural-network', 'continuous integration', 'training-data', 'unity3d-unet', 'machine-learning']"
829,Strategy for test pipeline with .NetCore and KAFKA,"['testing', 'continuous-integration', 'continuous integration', 'apache-kafka', '.net-core']"
830,Wsdl2Java vs. wsimport,"['web-services', 'wsimport', 'wsdl2java', 'continuous integration']"
831,Why does Geronimo Javamail not fetch the message subject and collides with default JVM implementation?,"['javamail', 'java', 'continuous integration']"
832,how to set up GitLab CI for iOS project,"['ios', 'gitlab', 'continuous-integration', 'continuous integration', 'gitlab-ci', 'cocoapods']"
833,How can I free malloc,"['ubuntu', 'c++11']"
834,How to build a continuous integration for a .net core project which includes T4 files,"['docker', 'continuous-integration', 'continuous integration', '.net-core', 't4']"
835,"In NUnit [TearDown], how to find out whether the test was run solo?","['testing', 'nunit', 'continuous integration']"
836,R package build failing on Windows machines (AppVeyor) due to missing GSL - GNU Scientific Library,"['gsl', 'package', 'continuous integration', 'r', 'windows', 'appveyor']"
837,TFS How to Build Visual Studio-based &quot;Open Folder&quot; CMake project,"['cmake', 'continuous integration', 'arm', 'visual-studio-2017', 'tfs']"
838,Karate CI problems,"['karate', 'qa', 'continuous integration']"
839,How to push IPA and APK file to App Center Distribute from appcenter command line and Jenkins,"['ios', 'android', 'continuous integration']"
840,Where I can find the CI service for symphony project?,"['symfony', 'continuous integration']"
841,Send allure report results to aws s3,"['rspec', 'ruby', 'continuous integration', 'amazon-s3', 'allure']"
842,Using a jenkins pipeline to build github pull requests,"['jenkins-pipeline', 'jenkins-plugins', 'github', 'continuous integration']"
843,Continuous integartion using Jenkins applying it to Symfony 3.3 Run automaticaly PhpUnit and generate reports of results,"['symfony', 'xml', 'continuous-integration', 'continuous integration', 'jenkins', 'phpunit-testing']"
844,JMeter - how to check if there are any failing assertions with BeanShell,"['beanshell', 'jmeter', 'continuous integration']"
845,How to run Gnome-Shell inside Travis-CI?,"['gnome-shell-extensions', 'gnome-shell', 'travis-ci', 'continuous integration']"
846,"How to configure Typescript, Karma, Webpack to run tests in browser","['webpack', 'karma-runner', 'typescript', 'continuous integration']"
847,Building a solution containing .net standard 2.0 project in team foundation server 2012 server,"['visual-studio', 'continuous integration', 'visual-studio-2017', 'tfs', 'msbuild']"
848,How can I install ODBC Driver 13 for SQL Server on Travis CI?,"['travis-ci', 'docker', 'sql-server', 'continuous integration', 'odbc']"
849,Matching intent in DialogFlow on longer speech section,"['dialogflow', 'continuous integration']"
850,Error: &quot;extract-text-webpack-plugin&quot; loader is used without the corresponding plugin,"['webpacker', 'extracttextwebpackplugin', 'reactjs', 'continuous integration', 'karma-runner', 'extract-text-plugin']"
851,Web Application Infrastructure for continuous integration - How many servers?,"['version-control', 'testing', 'continuous integration', 'infrastructure', 'server', 'teamcity']"
852,Continuous Integration - Don&#39;t move laravel .env files to azure using bitbucket pipelines,"['laravel', 'azure', 'continuous-integration', 'continuous integration', 'bitbucket-pipelines', 'bitbucket']"
853,Firebase VDT does not run Gherkin (Cucumber) tests,"['firebase-test-lab', 'android', 'cucumber', 'continuous integration']"
854,Jenkins Build Trigger after each commit to Github,"['build-triggers', 'jenkins', 'triggers', 'continuous integration']"
855,Skip compilation of localized resources,"['azure-devops', 'continuous-integration', 'continuous integration', 'tfs', 'azure-pipelines', 'msbuild']"
856,Using Azure DevOps release unable to run vsts2017 web tests in azure CI pipeline,"['performance', 'continuous integration']"
857,multidimentional kde heatmap,"['python', 'geolocation', 'kde', 'continuous integration']"
858,Run protractor in localhost server during countinuous integration,"['integration-testing', 'testing', 'continuous integration', 'protractor', 'angularjs']"
859,Getting blank page afer installing OSPOS on Apache,"['ubuntu', 'apache']"
860,Spring Integration Java DSL: Create and destroy the integration flows continuously,"['spring-integration-dsl', 'spring-integration', 'continuous integration']"
861,How do you automate data loads in visual studio?,"['visual-studio', 'sql-server', 'continuous integration', 'database', 'ssis']"
862,"How to force a full (not shallow) clone of submodules, overriding .gitmodules","['git-submodules', 'git', 'continuous integration']"
863,Build and Test the ASP.NET Website and Libraries without having Visual Studio,"['mstest', 'build-server', 'continuous-integration', 'continuous integration', 'msbuild', 'devops']"
864,manage mocha project with karma,"['node.js', 'testing', 'continuous integration', 'karma-mocha', 'karma-runner', 'javascript']"
865,Creating new Tensorflow Devices multiple times,"['python', 'ubuntu', 'deep-learning', 'c++', 'deeplab', 'tensorflow']"
866,start-dfs.sh throws port 22: connection timeout error,"['hadoop', 'ubuntu', 'hdfs']"
867,/usr/bin/env: &#39;ruby&#39;: No such file or directory userdata in codedeploy ubuntu,"['ubuntu-14.04', 'aws-code-deploy', 'ubuntu', 'amazon-cloudformation']"
868,MariaDB using all available ram,"['ubuntu', 'mariadb']"
869,react-rails in production can not create new object,"['reactjs', 'ubuntu', 'ruby-on-rails']"
870,How to log the live output of a process running inside a named pipe?,"['linux', 'ubuntu', 'pipe', 'bash']"
871,Ampps wont start in Deepin,"['ubuntu', 'ampps', 'lamp', 'linux', 'debian']"
872,I dont know how to use ForEach in this situation,"['html', 'css', 'ubuntu', 'javascript']"
873,Problem with install Symfony 4 production server on apache2,"['ubuntu', 'symfony', 'server', 'ubuntu-19.04', 'production']"
874,Cannot use end points on public ip,"['nginx', 'ubuntu', 'docker', 'fastapi', 'angular']"
875,Unit tests not running (loading) in Odoo 12,"['python', 'ubuntu', 'odoo', 'odoo-12', 'unit-testing']"
876,How to link static style files to Django app on Apache,"['ubuntu', 'apache', 'mod-wsgi', 'django', 'virtualbox']"
877,Are pipe() and socket() thread safe?,"['ubuntu', 'c++11', 'file-descriptor', 'thread-safety', 'linux']"
878,Mqtt server keep printing the same message,"['mosquitto', 'mqtt', 'ubuntu']"
879,"How to fix, &quot;Error: Request failed with status code 404&quot; in axios Next js","['nginx', 'ubuntu', 'reactjs', 'next.js', 'javascript', 'axios']"
880,How to run TensorBoard in Docker container without root privileges?,"['tensorflow-datasets', 'ubuntu', 'docker', 'tensorboard', 'tensorflow']"
881,"why when I open ubuntu bash with wsl, I get an error ?and i don&#39;t know how to solve it","['ubuntu', 'windows-subsystem-for-linux']"
882,I have a problem with Scalatra project in Ubuntu,"['scala', 'ubuntu']"
883,Segmentation fault (core dumped) when trying to call assembly functions from C,"['assembly', 'c', 'ubuntu', 'x86-64']"
884,Difficulty installing sinatra and rails using gem,"['ubuntu', 'ruby', 'sinatra', 'ruby-on-rails', 'rubygems']"
885,psutil on Linux shows no CPU Core Temperatures,"['python', 'ubuntu', 'python-3.x', 'lm-sensors', 'psutil']"
886,"I am in trouble, I don&#39;t want to reinstall the OS again","['ubuntu-14.04', 'ubuntu', 'python-3.x']"
887,make error while building Hello ZED example,"['ubuntu', 'camera', 'cuda', 'computer-vision', 'installation', 'nvidia']"
888,R package: devtools::install_github(&quot;cran/rgeos&quot;) encounters error on ubuntu 16.04,"['r', 'gcc', 'ubuntu']"
889,What return code does systemctl status return for an error in systemctl status (not the underlying service)?,"['systemctl', 'ubuntu', 'systemd']"
890,Detect change in CodeCommit and run command in EC2 instance,"['amazon-ec2', 'amazon-web-services', 'ubuntu', 'git']"
891,How to solve the handshake failure using ssl in python?,"['linux', 'ubuntu', 'openssl', 'python-3.x']"
892,which hcitool cmd to force GFSK/BFSK for bluetooth tethering?,"['linux', 'ubuntu', 'bluetooth']"
893,What is a good choice for embedded Linux GUI development?,"['user-interface', 'swing', 'ubuntu', 'embedded', 'embedded-linux', 'qt']"
894,Server Code for Shiny-Server for a Specific App is not showing any of the Dataframes,"['shiny-server', 'ubuntu']"
895,busybox init script. Mount not found,"['initramfs', 'linux', 'ubuntu', 'busybox']"
896,"After Git clone files belong to wrong user, cannot edit","['readonly', 'clone', 'ubuntu', 'git', 'github']"
897,Why my python tkinter code is not working?,"['tkinter', 'ubuntu', 'python-3.x']"
898,How to acess Linux bash terminal with new Windows Terminal,"['windows-10', 'ubuntu', 'terminal', 'windows-subsystem-for-linux', 'terminal-emulator', 'windows']"
899,How do I instrument only the actual benchmark of SPEC CPU2006 with Intel&#39;s Pin?,"['ubuntu', 'benchmarking', 'bash', 'instrumentation', 'intel-pin']"
900,Getting error when trying to integrate ansible with checkpoint Management server,"['ansible', 'ubuntu']"
901,How do I correctly restart mysql so that changes in the `*.cnf`-files get active?,"['ubuntu', 'mysql', 'mariadb', 'erpnext', 'linuxmint']"
902,Getting errors when using ImGui with OpenGL,"['imgui', 'ubuntu', 'opengl']"
903,How to connect to postgresql in vm from host machine,"['postgresql', 'pgadmin', 'ubuntu', 'virtualbox']"
904,How to schedule the kivy camera to read the texture continuously?,"['python', 'kivy', 'ubuntu', 'python-3.x']"
905,How to identify the signal 11 error reason?,"['compiler-errors', 'linux', 'ubuntu', 'c++11']"
906,Cannot build the HelloWorld Poco Example Program on Ubuntu,"['ubuntu', 'poco', 'c++', 'hyperlink', 'g++']"
907,PHP year 2038 problem with 64bit MySQL can&#39;t insert date through PHPMyAdmin,"['ubuntu', 'mysql', 'laravel', 'php', 'date', 'phpmyadmin']"
908,"The &#39;Access-Control-Allow-Origin&#39; header contains multiple values &#39;http://localhost:3000, http://localhost:3000&#39;, but only one is allowed","['nginx', 'cors', 'ubuntu', 'reactjs']"
909,defining root user in supervisor program not working?,"['python', 'supervisor', 'ubuntu', 'environment-variables']"
910,Workaround for OS X Docker &#39;Directory renamed before its status could be extracted&#39;,"['tar', 'ubuntu', 'docker', 'macos']"
911,Cannot connect to clearDB on heroku with command line,"['heroku', 'ubuntu', 'cleardb']"
912,Why file is not getting accessed on the server?,"['laravel', 'server', 'ubuntu', 'apache']"
913,How to set up a network-manager service to configure a modem connection automatically?,"['dhcp', 'ubuntu', 'networkmanager', 'huawei', 'ubuntu-18.04']"
914,How to run application that installed using Snapcraft,"['ubuntu', 'snapcraft', 'ngrok', 'mint', 'linux']"
915,Ktor app is not running inside Kotlin Multiplatform Project using IntelliJ IDEA,"['ktor', 'intellij-idea', 'ubuntu', 'kotlin-multiplatform']"
916,adb: error: cannot bind listener: Operation not permitted,"['ubuntu', 'react-native', 'adb', 'android', 'react-native-android']"
917,"How does the apache2 server know which config file to look into, if there are multiple config files for multiple websites in ubuntu","['ubuntu-16.04', 'ubuntu', 'apache2.4']"
918,How can I use javafx in linux without any IDE,"['javafx', 'ubuntu', 'terminal', 'java', 'linux']"
919,Python Tika cannot read PDF - fail to download Tika Server,"['python', 'ubuntu', 'http-status-code-504', 'tika-server', 'apache-tika', 'pdf']"
920,Get a folder&#39;s mount point using java,"['ubuntu', 'java', 'filesystems', 'file']"
921,How to fix &quot;ssh: connect to host ***.****.***.*** port 22: Connection timed out&quot; digitalocean ubuntu server,"['server', 'ubuntu']"
922,How to tunnel to tomcat remote server behind apache,"['ssh-tunnel', 'ubuntu', 'jmx']"
923,video element not rendering react chromium,"['ubuntu', 'reactjs', 'html', 'css', 'react-redux']"
924,How to redirect specific extentionless endpoint to another endpoint with extension,"['php', 'ubuntu', '.htaccess', 'apache2']"
925,How to listen to oggdemux gstreamer failures?,"['gstreamer-1.0', 'ubuntu', 'ogg', 'opus', 'gstreamer']"
926,How can I connect to oracle 12c via ODBC driver in qt?,"['ubuntu', 'oracle', 'qt', 'c++', 'odbc']"
927,Route53 not including glue records,"['amazon-route53', 'ubuntu', 'dns']"
928,How to use Docker-compose and Connecting a PHP:Apache Container and MSSQL Container,"['docker-compose', 'ubuntu', 'docker', 'sql-server', 'php']"
929,"I want to rename multiple folders, that all have a specific part I want to remove","['rename', 'regex', 'ubuntu', 'batch-rename', 'linux']"
930,Cron tab to run every two minutes after X minute of the hour,"['cron', 'unix', 'linux', 'ubuntu']"
931,Could I get some help installing catkin tools and rosdep for python,"['catkin', 'ubuntu', 'ros']"
932,"Error 503 Backend fetch failed, when I pointed the domain to the IP","['ubuntu', 'bitnami', 'magento', 'amazon-lightsail', 'wordpress']"
933,executable python file does not run with selenium in Ubuntu 18,"['python', 'cron', 'ubuntu', 'pythonpath', 'selenium-chromedriver']"
934,How can I add Sqlite jar file to executable jar file?,"['sqlite', 'ubuntu', 'java', 'netbeans-8']"
935,Nomad : Health Check,"['nginx', 'nomad', 'ubuntu']"
936,Android emulator device is runnign in a VM?,"['kvm', 'android-studio-2.2', 'ubuntu', 'java']"
937,Error when trying repo init on external drive on Ubuntu,"['python', 'ubuntu', 'symlink', 'repo', 'android-source']"
938,"load glyph failed err=23 face=0x0, glyph=25 Error in Qt","['qt5', 'ubuntu', 'qt']"
939,How to solve &quot;zookeeper.ClientCnxn Connection refused&quot; problem in Hbase?,"['ubuntu', 'hbase']"
940,My threads stop sending messages (via rabbitmq) to one another after two steps: how to fix that?,"['ubuntu', 'java', 'rabbitmq']"
941,"Error when running envoy task, server [ server_name] is not defined","['php', 'ubuntu', 'envoyproxy', 'laravel']"
942,Using multiprocessing Queue to prevent corrupt plots from being generated,"['parallel-processing', 'multicore', 'ubuntu', 'ubuntu-18.04', 'python-2.7', 'multiprocessing']"
943,Ubuntu 16.04 mdadm automatically recognized raid 10 as raid 0,"['raid', 'ubuntu', 'mdadm']"
944,"Error: Host Key verification failed, while deploying via SSH and Gitlab CI","['gitlab-ci', 'gitlab', 'ubuntu', 'ssh']"
945,Zikula CMS - Installation issue,"['ubuntu', 'apache', 'symfony', 'zikula', 'routing']"
946,Ubuntu PHP 5 Install Curl Cannot Find Package,"['php-curl', 'php', 'ubuntu', 'curl']"
947,how to install the last copied file on ubuntu,"['linux', 'ubuntu', 'shell', 'bash']"
948,ERROR in ./src/main.ts Module build failed (from ./node_modules/@ngtools/webpack/src/index.js):,"['ubuntu', 'angular']"
949,Windows 10 1903 WSL Ubuntu 18.04 Background Color Scrolling Problem,"['ubuntu', 'vi', 'windows-subsystem-for-linux']"
950,Is there a known issue with memory leaks in Python dicts or Numpy iterators?,"['python', 'memory-leaks', 'ubuntu', 'gdal', 'numpy']"
951,multiprocessing.pool.MaybeEncodingError when using hypopt GridSearch with RFR,"['python', 'ubuntu', 'hyperparameters', 'python-3.x', 'scikit-learn', 'multiprocessing']"
952,Building a c++ library using CMake in Android Studio,"['android-ndk', 'cmake', 'ubuntu', 'android-studio', 'c++', 'android']"
953,How to fix incorrectly UTF-8 decoded string?,"['python', 'ubuntu', 'utf-8']"
954,400 bad Request on Elastic Beanstalk using Cloudflare,"['nginx', 'ssl', 'ubuntu', 'amazon-elastic-beanstalk']"
955,How to set file permissions on NTFS partition with Ubuntu?,"['permissions', 'ubuntu', 'ssh', 'ntfs', 'ext4']"
956,java.security.InvalidKeyException: Invalid key seen after ubuntu update,"['ubuntu', 'java', 'rsa', 'hibernate']"
957,Nginx not redirecting,"['nginx', 'server', 'ubuntu', 'nginx-reverse-proxy']"
958,R package not available in batch mode,"['r', 'ubuntu']"
959,How to build Alljoyn for ubuntu 18.04,"['build', 'ubuntu', 'ubuntu-18.04', 'alljoyn']"
960,Jenkins Failing on &#39;git pull&#39;,"['gitlab', 'ssl', 'ubuntu', 'jenkins']"
961,Ubuntu 18.04 broken after wrong python manipulation,"['python', 'ubuntu']"
962,"PostgreSQL(libpq) version update , PDO, PHP","['php', 'ubuntu']"
963,Issue with SSH-copy-id -i on UBUNTU 18.04,"['openssh', 'ubuntu', 'ssh', 'ubuntu-18.04', 'ssh-keys']"
964,How to add gzip compression to Hypercorn server serving a Quart app,"['quart', 'ubuntu', 'asgi', 'gzip']"
965,"Ubuntu, shopsys install via composer, docker, still crashing","['composer-php', 'ubuntu', 'docker']"
966,Node JS app shuts down after ten seconds in Production env but runs fine on local env,"['node.js', 'ubuntu', 'javascript', 'mysql']"
967,Memory Leak in CNN for image classification,"['ubuntu', 'python-3.x', 'keras', 'deep-learning', 'tensorflow']"
968,Is it recommended practise to deploy Application Credentials to a live system,"['google-authentication', 'ubuntu', 'firebase']"
969,Cannot install node version 8.11.2 into my ubuntu machine,"['node.js', 'ubuntu', 'ubuntu-18.04']"
970,python versions are not working in ubuntu,"['python', 'ubuntu', 'pip', 'python-3.x']"
971,Will dolfin run or not?,"['ubuntu', 'spyder']"
972,Updated to php7.2 zip unlimited creating files,"['zip', 'php', 'ubuntu', 'laravel']"
973,postgres/VM: no space left on the device,"['postgresql', 'ubuntu', 'virtualbox']"
974,WebSocket opening handshake timed out in https,"['nginx', 'ssl', 'ubuntu', 'django', 'uwsgi', 'websocket']"
975,How to clean memory from old and unused file in ubuntu 18.04,"['ubuntu-18.04', 'ubuntu', 'memory']"
976,How to fix &quot;SPI_ERROR_UNCONNECTED&quot; error while installing PL/Java on Postgresql-9.5,"['postgresql-9.5', 'ubuntu', 'pljava']"
977,QRCode Barcode reader or api,"['php', 'api', 'image api', 'image', 'pdf']"
978,FTP reply strings are different for different machines,"['ftp-client', 'ftp', 'ubuntu', 'java']"
979,Application name displayed as Unknown with fbs and PyQt5,"['python', 'ubuntu', 'pyqt', 'python-3.x', 'fbs', 'pyqt5']"
980,PHP offers Roudcube&#39;s index.php as Download,"['nginx', 'roundcube', 'ubuntu', 'php', 'debian']"
981,Error when attempting to install Go-SQL-Driver: undefined: syscall.Conn,"['go', 'driver', 'ubuntu', 'ubuntu-16.04']"
982,Why do i get vue-cli errors while setting up a new project,"['vue-cli-3', 'ubuntu', 'vuejs2', 'yarn', 'vue.js', 'npm']"
983,Postman getting 404 error for ASP.NET Core Web API,"['asp.net-core-webapi', 'postman', 'ubuntu', '.net-core']"
984,PhpStorm keeps asking me to unlock my ssh private key,"['ubuntu', 'phpstorm']"
985,Convertion of .arf file to .mp4 in ubuntu,"['ubuntu', 'converters', 'webex', 'cisco', 'mp4']"
986,"MongoDB shut down in the middle of the night, can&#39;t get back up","['nginx', 'mongodb', 'ubuntu']"
987,Kubernetes DNS and NetworkPolicy with Calico not working,"['ubuntu', 'kubernetes']"
988,Fatal error: Call to undefined function mysqli_connect(). No any execute after function,"['ubuntu', 'mysql', 'mariadb', 'php', 'linux', 'apache2']"
989,Cannot run project in Android Studio 3.4.1 on Samsung Devices,"['build', 'exception', 'ubuntu', 'android-studio', 'java', 'android']"
990,How to open pages that contains Jscript (Not JavaScript ) in ubuntu browsers,"['ubuntu', 'javascript', 'browser']"
991,Don&#39;t have the &quot;include navigation controller&quot; option when making a new project in android studio 3.4.1,"['android', 'android-studio', 'ubuntu', 'kotlin']"
992,C# .NET Core Console.ReadKey(true) doesn&#39;t intercept the key on Ubuntu,"['.net-core', 'ubuntu', 'terminal', 'c#']"
993,Ambari Agent Registration failed due to unsupported OS type,"['hadoop', 'ubuntu', 'ambari']"
994,VoIP authorization using a certificate,"['ubuntu', 'apple-push-notifications', 'voip', 'certificate']"
995,How to set currency to setlocale / money_format in PHP,"['php', 'currency', 'ubuntu', 'locale']"
996,vue init webpack project-name is not responding while hitting enter for project description,"['ubuntu', 'vue.js', 'vue-cli', 'webpack']"
997,how to create a flask api on top of running tensorflow-serving image,"['tensorflow-serving', 'image api', 'flask']"
998,Traefik proxy to docker containers yields 404 not found for all subdomains,"['traefik', 'ubuntu', 'docker']"
999,Visual Studio Code is not launching a browser when debuging a PHP Application [wordpress],"['visual-studio-code', 'ubuntu', 'vscode-settings', 'php', 'wordpress', 'vscode-debugger']"
1000,How to serve flask app through nginx using gunicorn on a custom domain?,"['nginx', 'ubuntu', 'dns']"
1001,How Do I create and configure l2tp Python socket,"['python', 'l2tp', 'ubuntu', 'networking']"
1002,How to run a command of a subprocess in same line opening the process,"['ubuntu', 'terminal', 'command-line-interface', 'linux', 'shell']"
1003,Dockerised Python Celery task not logging in customized format,"['python', 'python-3.x', 'django-celery', 'celery-task', 'image api', 'celery']"
1004,How to convert via the Coinbase API,"['coinbase-api', 'image api']"
1005,End keyword in print statement is not working in Python UBUNTU,"['python', 'ubuntu', 'runtime-error', 'pycharm', 'numpy']"
1006,How do I create GCloud LXD Bridge Devices without adding more vNICs or breaking the VM?,"['ubuntu', 'nic', 'vpc', 'lxd', 'wordpress']"
1007,Generate YAML file from python with certain keys and values with double quotes,"['python', 'ubuntu', 'yaml']"
1008,I can not install conan because of the error: &quot;SSL: Certificate Verify Failed (_ssl.c:590)&quot;,"['python', 'conan', 'ubuntu', 'pip']"
1009,"Snakemake claims rule exits with non-zero exit code, even with &quot;|| true&quot;?","['python', 'ubuntu', 'snakemake', 'bash']"
1010,Cross-Origin Request Blocked MEAN stack application,"['ubuntu', 'node.js', 'express', 'cors', 'cross-origin-read-blocking']"
1011,Ubuntu did not install chromium for puppeteer,"['ubuntu', 'puppeteer', 'chromium']"
1012,Can&#39;t get a connection between file upload form to a localhost route (JavaScript),"['multer', 'file-upload', 'html', 'image api', 'forms', 'javascript']"
1013,How to speed up conversion array of shorts to bitmap in Kotlin,"['performance', 'java', 'image api', 'kotlin', 'android']"
1014,why is jodit image form data empty with and without using enableDragAndDropFileToEditor?,"['image api', 'jodit']"
1015,Docker mysql image keeps failing on Raspberry Pi with Arch ARM,"['mysql', 'mariadb', 'docker', 'image api', 'raspberry-pi3']"
1016,Android Studio get api,"['android', 'image api', 'http']"
1017,How to get Asset URL when using PHPhotoLibrary to save image and video?,"['phphotolibrary', 'ios', 'phasset', 'alassetslibrary', 'image api']"
1018,rest api - sending and receiving image,"['httpclient', 'rest', 'image api', 'c#']"
1019,Capture and upload image to server using Ionic 4,"['jersey', 'ionic4', 'rest', 'image api', 'angular', 'typescript']"
1020,Uploaded Image&#39;s Path is Broken in ASP.NET - unable to show Image,"['asp.net', 'c#', 'relative-path', 'image api', 'image']"
1021,How to post a tweet with an image to a website without including the URL in the tweet body?,"['python', 'python-twitter', 'twitter', 'image api']"
1022,mapview pin image not changed swift,"['mkmapview', 'image api', 'swift']"
